{
  "mode": "poster",
  "tone": "reflective",
  "title": "与不确定性共处",
  "subtitle": "野生肯尼 · 阅读札记",
  "cards": [
    {
      "body": [
        {
          "type": "heading",
          "text": "处境 / 不确定感从哪里来"
        },
        {
          "type": "paragraph",
          "text": "文章把20多岁的不确定感，放回四种现实处境中理解。"
        },
        {
          "type": "items",
          "entries": [
            {
              "label": "经验不足",
              "text": "进入复杂的成人情境，仍像刚开始学习。"
            },
            {
              "label": "缺少参照",
              "text": "缺乏成功逆袭的历史数据。"
            },
            {
              "label": "外部评分",
              "text": "失去外在打分体系，\n处在标准不明确的过渡阶段。"
            },
            {
              "label": "选择过多",
              "text": "可能性很多，选择本身却成为难题。"
            }
          ]
        }
      ]
    },
    {
      "body": [
        {
          "type": "heading",
          "text": "误区 / 想把后悔彻底排除"
        },
        {
          "type": "paragraph",
          "text": "文中的年轻听众有很多选择，却想预先确定幸福、彻底排除后悔。文章将这种完美主义，理解为对后悔的防备。"
        },
        {
          "type": "heading",
          "text": "尝试 / 给自己几个支点"
        },
        {
          "type": "paragraph",
          "text": "文中给出的三个尝试入口："
        },
        {
          "type": "items",
          "entries": [
            {
              "label": "具体任务",
              "text": "给内心吵闹的声音安排具体任务，\n把它视为升级信号。"
            },
            {
              "label": "自我锚定",
              "text": "花5分钟，建立一份自我锚定歌单。"
            },
            {
              "label": "换个问题",
              "text": "想一想：20年后，\n没有选择哪件事会最遗憾？"
            }
          ]
        }
      ]
    }
  ],
  "variant": "field-notes"
}
